The Terms of Service state that, "AgileBits, Inc. its subsidiaries, affiliates, and its licensors do not warrant that a) the Service will function uninterrupted, secure or available at any particular time or location."^bad
The Terms of Service state, "Your use of the Service is at your sole risk. The Service is provided on an “AS IS” and “AS AVAILABLE” basis."^bad
“500px reserves the right, at its sole discretion, to modify or replace the terms at any time. If the alterations constitute a material change to the terms, 500px will notify you by Posting an announcement on the site. What constitutes a material change will be Determined at 500px’s sole discretion.”^bad
“500px may terminate your store account at any time for any reason or no reason. All Store Images remaining in your Store account will be removed by 500px upon termination of your store account.”^bad
The copyright license you grant to 500px is transferable and sublicensable. The copyright license is limited for use “in connection with the Services” which includes promotional uses and redistribution “to other parties, web-sites, applications, and other entities” if you are credited properly. The license on your content terminates when you remove such content.^bad
“You shall not have any right to terminate the permissions granted herein, nor to seek, obtain, or enforce any injunctive or other equitable relief against 500px, all of which such rights are hereby expressly and irrevocably waived by you in favour of 500px.”^bad
You do not have to provide your legal name (except for paid accounts for billing purposes) and you can use the service with a pseudonym.^good
500px provides an easy to read summary of the terms on the right side. This provides a pleaseant reading experience. However some of the summaries are a bit misleading and should not omit important details.^good
targeted third-party advertising^bad
You can not delete your account. You can only beg AirBnB to do it for you:  "If you want to permanently close and delete your account, contact us." In that case AirBnB will insist that you to provide further personal information to "We will verify your identity for security purposes before accepting the deletion request." which is up to them to accept or insist more proof for their records. So effectively, you can not delete your account from this service. This happened to me and the account still exists as I refused to keep sending them more and more documents just close the account while the original reason for closing the account was them violating my privacy.^blocker
Airbnb shows the last change of the ToS^neutral
Users have the right to cancel their account at any time. However, this cancellation is only effective after the 30-day term of the agreement is over.^good
|If you reside in the United States of America, the court of law is in San Francisco, California.
If you reside in China, any disputes must be submitted to the China International Economic and Trade Arbitration Commission (CIETAC) and proceedings shall be held in English, which is incredibly unfair to Chinese natives.
If your country of residence is outside of the United States and China, Irish law applies and you agree to submit to the jurisdiction of the Irish courts.|^neutral
 We do so through the processing of transaction logs, as well as the use of various technologies, including scripts,  tags,  Local  Shared  Objects  (Flash  cookies),  Local  Storage  (HTML5)  beacons, and cookies.^bad
They can change the terms of service any time they see fit, even without notification to the user. Your use of the service supposedly constitutes acceptance of the changes in the terms.^bad
This service uses cookies to track you even if you are not interacting with them directly. Amazon for instance, use <a href="http://www.amazon.com/gp/help/customer/display.html/ref=hp_468496_cookies?nodeId=468496&amp;#cookies">cookies</a> to track your device and serve targeted advertisements on other websites (Amazon associates, websites using Amazon Checkout). They “obtain certain types of information when your Web browser accesses Amazon.com or advertisements and other content served by or on behalf of Amazon.com on other Web sites”.^bad
See excerpt.^good
Amazon may sell user data as part of a business transfer^bad
[Bad] Amazon holds unlimited copyright license on your content^bad
Amazon can cancel your account and remove content at any time.^bad
Amazon uses your personal data and your behavior data for advertisement.^bad
Although Amazon does not share your personal informaton to advertiers and other third-parties that display Amazon's ads, by default they enable third-party advertises to target you (IP, cookies or “other features”). However, you <a href="http://www.amazon.com/gp/dra/info">can opt-out</a>.^bad
While Amazon grants users some control over their personal information, the service also warns that users may sacrifice quality of experience on the website if they limit the information that they give.^good
Amazon&#39;s providers may not use your data for other purposes^good
Amazon may release your data when they believe it appropriate^bad
Amnesty International Limited (UK) sometimes shares personal information, e.g. of potential members, with other membership organizations of its movement. When it does, arrangements are in place to ensure that the recipient processes that personal information to an EU standard.^good
There is nothing mentioned in ToS about making changes or informing users about changes, nor the date when the last changes were made, nor an archive of old versions.^bad
While Amnesty International (UK) may share your data to be processed in its other global sections, these are held to the EU standards for data sharing and processing by contractual agreements (https://edit.tosdr.org/points/4557).^bad
Amnesty International uses third parties for hosting its website, processing online payments and applications for employment, recruiting potential supporters and managing online actions and related communications.^bad
|The documents are written in understandable, less legal terms and structured well.
Additionally, the documents are kept reasonably short.|^good
The Privacy Policy and Cookie Statement are available in English, French, Spanish and Arabic and so is the entire website. Since the website provides no other service than (written) information, it will only be used by people who understand one of the available languages, who will thus also understand the legal documents.^neutral
See excerpt.^bad
Apple may change their Terms of Use at any time and it is your responsibility to keep up to date on these changes. By using the site you accept these terms.^bad
They can change the terms of service any time they see fit, even without notification to the user. Your use of the service supposedly constitutes acceptance of the changes in the terms.^bad
Apple.com indemnity^bad
Apple provides an opt-out method for Apple targeted advertising^good
Apple.com has an age restriction of 13 years^neutral
Apple.com can delete your account without notice^neutral
court of law is in location X^neutral
Apple.com juristiction^neutral
arc games^neutral
"We collect some data automatically - Like [...] what browser and device you’re using."^bad
"We collect some data automatically - Like [...] what browser and device you’re using."^bad
The Terms and Conditions state, "YOU UNDERSTAND, AGREE AND ACKNOWLEDGE THAT THE PLATFORM IS PROVIDED "AS IS" WITHOUT ANY EXPRESS OR IMPLIED WARRANTIES OF ANY KIND . . . THE USE OF THE PLATFORM IS AT YOUR OWN RISK."^bad
The Terms and Conditions state that in order to use BetterHelp, users must be at least 18 years old of age, or that users are 13 years or older, with the consent of a parent or legal guardian.^neutral
The court of law governing the terms is in U.S. District Court for Northern District of California, or state courts in Santa Clara County, California.^neutral
defend, indemnify, hold harmless^bad
"Social media cookies. These cookies are used when you share information using a social media sharing button or “like” button on our websites or you link your account or engage with our content on or through a social media site. The social network will record that you have done this. This information may be linked to targeting/advertising activities. "^bad
The Cloud Terms of Service specifies that, "The Cloud Products are not intended for, and should not be used by, anyone under the age of 16. You are responsible for ensuring that all End Users are at least 16 years old."^neutral
The collection of personal identification information is limited to Registered Users of the Service. Registered Users may be asked for, as appropriate, their name, age, address, email address and/or phone number. Such personal identification information will only be collected from Registered Users if they voluntarily submit such information to us. Users can always refuse to supply personal identification information, with the understanding that it may prevent them from engaging in certain Service related activities. Explicit consent to this Privacy Policy is required when registering as a User of the Service.^good
|In special limited cirumstances we may be required to disclose your data without express consent, these are:
To any successor or purchaser in a merger, acquisition, liquidation, dissolution or sale of assets.|^bad
|In special limited cirumstances we may be required to disclose your data without express consent, these are:

When we have a good faith belief it is required by law.
When we have a good faith belief it is necessary to protect our rights or property.
To any successor or purchaser in a merger, acquisition, liquidation, dissolution or sale of assets.
Your consent will not be required for disclosure in these cases, but we will attempt to notify you, to the extent permitted by law to do so.

|^good
|We may collect and use Users information for the following purposes:

To improve customer service. Information you provide helps us respond to your customer service requests and support needs more efficiently.
To improve the Service. We may use feedback you provide to improve our products and services.
To run a promotion, contest, survey or other feature. To send Users information they agreed to receive about topics we think will be of interest to them.
To send periodic emails. We may use the email address to send User information and updates pertaining to their subscriptions, activity and/or orders. It may also be used to respond to their inquiries, questions, and/or other requests. If User decides to opt-in to our mailing list, they will receive emails that may include company news, updates, related product or service information, etc. If at any time the User would like to unsubscribe from receiving future emails, we include detailed unsubscribe instructions at the bottom of each email.|^good
If at any time a Registered User wishes to withdraw their consent to this policy they can do so via their profile settings page. Withdrawal of consent will result in the Account concerned being suspended and scheduled for termination. All content, activity and associated information relating to the Account will be removed as part of this process.^good
BitTorrent may disclose personally identifiable information in the event of a business transfer or "corporate reorganization", which is very vague.^bad
From Privacy Policy, "We may share User Personal Information if we are involved in a merger, sale, or acquisition."^bad
From Privacy Policy, "We may share User Personal Information if we are involved in a merger, sale, or acquisition. If any such change of ownership happens, we will ensure that it is under terms that preserve the confidentiality of User Personal Information, and we will notify you on our website or by email before any transfer of your User Personal Information. The organization receiving any User Personal Information will have to honor any promises we have made in our Privacy Statement or in our Terms of Service."^good
From the Terms of Service, "Bitwarden does not warrant that the Service ... will be uninterrupted, timely, secure, or error-free"^bad
From Terms of Service, "Bitwarden provides the Website and the Service "as is" and "as available," without warranty of any kind."^bad
From Terms of Service, "Bitwarden does not target our Service to children under 13, and we do not permit any Users under 13 on our Service. If we learn of any User under the age of 13, we will terminate that User's account immediately. If you are a resident of a country outside the United States, your country's minimum age may be older; in such a case, you are responsible for complying with your country's laws."^neutral
Google (and thus Blogspot) collects vast amounts of different kinds of personal information.^bad
Quote that was there seems to be from the Google privacy policy; updated to the quote that is found in the docs of this service.^bad
The Terms of Service state that, "You represent, warrant, and agree that you will not contribute any Content or User Submission (each of those terms is defined below) or otherwise use the Services or interact with the Services in a manner that . . . “Crawls,” “scrapes,” or “spiders” any page, data, or portion of or relating to the Services or Content (through use of manual or automated means)."^bad
"The Children’s Online Privacy Protection Act (“COPPA”) requires that online service providers obtain parental consent before they knowingly collect personally identifiable information online from children who are under 13.  We do not knowingly collect or solicit personally identifiable information from children under 13. if you are a child under 13, please do not attempt to register for the Services or send any personal information about yourself to us.  If we learn we have collected personal information from a child under 13, we will delete that information as quickly as possible."^neutral
The Terms of Service state that, "You represent, warrant, and agree that you will not contribute any Content or User Submission (each of those terms is defined below) or otherwise use the Services or interact with the Services in a manner that . . . Violates any law or regulation, including any applicable export control and data privacy laws"^neutral
In the Terms of Use applicable to users in Europe, "We may revise these Terms of Use from time to time but the most current version will always be at https://brainly.com/pages/terms_of_use. Changes will usually occur because of new features being added to the Service, changes in the law or where we need to clarify our position on something. Normally, we will try to give you some warning before the new terms become effective. However, sometimes changes will need to be made immediately and if this happens we will not give you any notice." In the Terms of Use applicable to users not in Europe, "Brainly regularly reviews these Terms and may revise or update them at our sole discretion. Changes to these Terms become effective immediately upon their posting on the Brainly Services and your continued use of the Brainly Services following the posting of revised Terms represents that you have read, understood, and agreed to the changes."^bad
The Privacy Policy states, "We and our third party partners may also use cookies and tracking technologies for advertising purposes."^bad
In the Privacy Policy, it states that, "Although we do our best to honor the privacy preferences of our users, we are unable to respond to Do Not Track signals set by your browser at this time."^bad
For users not in Europe, "Brainly reserves the right, in its sole discretion, to immediately modify, suspend or terminate your account, the Brainly Services, your Brainly Subscription, and/or any products, services, functionality, information, content or other materials available on, through or in connection with the Brainly Services and/or your Brainly Subscription, including, but not limited to, the Mobile Software, and/or your access to some or all of them without cause and without notice. In the event that Brainly suspends or terminates your account, the Brainly Services or your Brainly Subscription, you acknowledge and agree that you shall receive no refund or exchange for any unused time on a Brainly Subscription or any subscription fees or anything else." However, for users in Europe, these terms state that, "We may end your access or use of the Service for any reason as long as we give you reasonable notice that we plan to do this."^bad
The Terms of Use (in Part A, applicable to users unless you are in Europe) state that, "If you choose to cancel [your subscription], your cancellation will take effect at the end of the subscription term in which you cancelled, and there are no refunds." It also states, "In the event that Brainly suspends or terminates your account, the Brainly Services or your Brainly Subscription, you acknowledge and agree that you shall receive no refund or exchange for any unused time on a Brainly Subscription or any subscription fees or anything else." The Terms of Use (in Part B, applicable to users in Europe) state, "Generally, we cannot give back the fees you pay to us."^neutral
The Privacy Policy states, "The Service may contain links to and from third party websites of our business partners, advertisers, and social media sites and our users may post links to third party websites. If you follow a link to any of these websites, please note that these websites have their own privacy policies and that we do not accept any responsibility or liability for their policies."^neutral
The Terms of Use (in Part A, applicable to users not in Europe) state, "By posting Your Content on the Brainly Services you irrevocably grant Brainly worldwide, non-exclusive, irrevocable, assignable and transferable perpetual rights to use Your Content, including, for example, your name, grade, school name or biographical information, for any purpose whatsoever." The Terms of Use (in Part B, applicable to users in Europe) state that Brainly has a "worldwide, non-exclusive, royalty-free and perpetual licence to use, copy, reproduce, distribute, adapt, re-format, modify, publish, translate, license, sub-license and otherwise make available the User Content anywhere and in any form for the purposes of providing the Service."^bad
The Privacy Policy states, "We may modify or update this Privacy Policy from time to time to reflect the changes in our business and practices, and so you should review this page periodically. When we change the policy in a material manner we will let you know and update the ‘last modified’ date at the bottom of this page. If you object to any changes, you may close your account. Continuing to use our Service after we publish changes to this Privacy Policy means that you are consenting to the changes. "^neutral
The Terms of Use in Part A, applicable to users unless you are in Europe, state that, "By posting Your Content on the Brainly Services you irrevocably grant Brainly worldwide, non-exclusive, irrevocable, assignable and transferable perpetual rights to use Your Content, including, for example, your name, grade, school name or biographical information, for any purpose whatsoever, including, for example, to create derivative works, use for advertising or marketing, or repurpose in another medium."^bad
From the Terms of Use (Part B, applicable to users in Europe), it states, "We value hearing from our users, and are always interested in learning about ways we can improve the Service. By providing your feedback you agree that you are giving up any rights you have in your feedback so that we may use and allow others to use it without any restriction and without any payment to you."^bad
The Privacy Poilicy says Brainly can track usage information and personal information "through a variety of tracking technologies, including cookies, web beacons, Locally Stored Objects (LSOs such as Flash or HTML5), log files, and similar technology (collectively, “tracking technologies”)."^bad
The Terms of Use and Privacy Policy both have a last update date.^neutral
In the Privacy Policy, it is stated that under section "4. SHARING OF YOUR INFORMATION," among the parties that Brainly "may share your personal information with," it includes "other parties in connection with a company transaction, such as a merger, sale of company assets or shares, reorganization, financing, change of control or acquisition of all or a portion of our business by another company or third party, or in the event of a bankruptcy or related or similar proceedings."^bad
The Terms of Use (in Part A, applicable to users unless you are in Europe) state that, "BRAINLY RESERVES THE RIGHT TO MODERATE THE BRAINLY SERVICES AND TO REMOVE, SCREEN, OR EDIT YOUR CONTENT FROM THE BRAINLY SERVICES AT OUR SOLE DISCRETION, AT ANY TIME, AND FOR ANY REASON OR FOR NO REASON, WITH NO NOTICE TO YOU."^blocker
The Terms of Use (in Part A, applicable to users not in Europe) state, "By posting Your Content on the Brainly Services you irrevocably grant Brainly worldwide, non-exclusive, irrevocable, assignable and transferable perpetual rights to use Your Content."^bad
The Cookie Policy states, "Service oparator [sic] informs that restricting the use of cookies may affect some of the functionalities available on the Website."^bad
In the Terms of Use applicable to users not in Europe, "THESE TERMS REQUIRE THE USE OF BINDING ARBITRATION ON AN INDIVIDUAL BASIS TO RESOLVE ALL DISPUTES ARISING UNDER THEM, RATHER THAN JURY TRIALS OR CLASS ACTIONS." It also states that, "YOU AND BRAINLY AGREE THAT THE SOLE AND EXCLUSIVE FORUM AND REMEDY FOR ANY AND ALL DISPUTES AND CLAIMS RELATING IN ANY WAY TO OR ARISING OUT OF THESE TERMS SHALL BE FINAL AND BINDING ARBITRATION." However, for the Terms of Use applicable to users in Europe, "English law will apply to all disputes and the interpretation of these Terms of Use. The English courts will have non-exclusive jurisdiction over any dispute arising from or related to your use of the Service."^bad
The Privacy Policy states that, "If you are located in the EU or Switzerland, you have the following rights in respect of your personal data that we hold: Right of access. The right to obtain access to your personal data. Right to rectification. The right to obtain rectification of your personal data without undue delay where that personal data is inaccurate or incomplete. Right to erasure. The right to obtain the erasure of your personal data without undue delay in certain circumstances, such as where the personal data is no longer necessary in relation to the purposes for which it was collected or processed . . . If you wish to exercise one of these rights, please contact us using the contact details at the end of this Privacy Policy." FOR ALL USERS, these Privacy Policy terms apply: "If you have any questions about reviewing, modifying, or deleting your information, or if you want to remove your name or comments from our Service or publicly displayed content, you can contact us directly at privacy@brainly.com. We may not be able to modify or delete your information in all circumstances. To request deletion of the personal information we have collected in connection with your Brainly account, please select the “I want to delete my account” option after logging into your account in Account Preferences. "^good
The Terms of Use (in Part A, applicable to users unless you are in Europe) state, "You agree to indemnify and hold each of Brainly, its subsidiaries, affiliates, officers, directors, employees and independent contractors, and any third parties providing content or services included in the Brainly Services or your Brainly Subscription, harmless from any claim or demand (including, but not limited to, reasonable legal fees) made by any third party due to or arising out of your use of the Brainly Services or your Brainly Subscription."^bad
The Terms of Use (in Part A, applicable to users unless you are in Europe) state, "BRAINLY MAKES NO WARRANTY THAT THE BRAINLY SERVICES AND/OR ANY PRODUCTS, SERVICES, FUNCTIONALITY, INFORMATION, CONTENT OR OTHER MATERIALS AVAILABLE ON, THROUGH OR IN CONNECTION WITH THE BRAINLY SERVICES OR YOUR BRAINLY SUBSCRIPTION, INCLUDING, BUT NOT LIMITED TO, THE MOBILE SOFTWARE, WILL MEET YOUR REQUIREMENTS, OR THAT THE BRAINLY SERVICES OR BRAINLY SUBSCRIPTIONS WILL OPERATE UNINTERRUPTED OR IN A TIMELY, SECURE, OR ERROR-FREE MANNER."^bad
|The Terms of Use (in Part A, applicable to users unless you are in Europe) state, "Any information obtained by monitoring, reviewing, or recording activity on the Brainly Services is subject to review by us or on our behalf as well as by law enforcement organizations in connection with investigation or prosecution of possible criminal activity on the Brainly Services. Brainly will comply with all court orders involving requests for such information."

 It is also stated in the Privacy Policy that personal information may be shared with "third parties as required by law or subpoena or if we reasonably believe that such action is necessary to (a) comply with the law and the reasonable requests of law enforcement; (b) to enforce our Terms of Service or to protect the security or integrity of our Service; and/or (c) to exercise or protect the rights, property, or personal safety of Brainly, our visitors, or others."|^good
