In the Privacy Policy, it states that the information collected by Brainly is used "to operate, maintain, and provide to you the features and functionality of the Service, complete transactions or services requested by you, tailor our programming and services to meet your needs and interests, as well as to communicate directly with you, such as to send you email messages. We may also send you Service-related emails or messages (e.g., account verification, change or updates to features of the Service, technical and security notices) . . . If you choose not to provide personal data, we may not be able to provide the Service to you or respond to your other requests."^good
The Privacy Policy provides details about what kinds of personal information they collect.^good
The Terms of Use (in Part A, applicable to users unless you are in Europe) state that, "Brainly uses a third-party payment processor, currently Zuora (https://www.zuora.com/), to process subscription payments. Please see Zuora’s privacy statement available on its site for information on how Zuora collects and uses personal information."^bad
The Privacy Policy states that "your information collected through our Service may be stored and processed in the United States or any other country in which Brainly or its affiliates or service providers maintain facilities."^bad
The Terms of Use (in Part A, applicable to users unless you are in Europe) state that, "Registered Users have the right to use the products, services and functionality provided by Brainly and the content and information published on the Brainly Services only within their own needs, for non-commercial purposes."^neutral
The FAQ states that "usernames can only be changed in extreme cases, like accidentally using your real name or giving out identifying information," meaning that you are allowed to use pseudonyms as a username.^good
The Terms of Use (in Part A, applicable to users unless you are in Europe) state that, "You agree not to use any automated tool, such as a web scraping tool, a bot or web robot, or web automation, to mine the Brainly Services or any products, services, information, or other materials available on, through or in connection with the Brainly Services or your Brainly Subscription, including, but not limited to, the Mobile Software, for information or to fill out forms on the Brainly Services, that you will not circumvent any technical measures implemented to prevent or limit such access, and that you will comply with the restrictions in any robot exclusion header."^bad
The Terms of Use (in Part B, applicable to users in Europe) state that you must not "use Brainly Services if we have suspended your access to it, or have otherwise banned you from using it."^neutral
The Community Guidelines state that user should "not use the Brainly Services do anything unlawful, misleading, malicious, or discriminatory." The Terms of Use also state, "You agree not to post on or transmit onto the Brainly Services or Mobile Software any information that you know to be untrue, that is unlawful, fraudulent, threatening, malicious, harassing, abusive, libelous, defamatory, obscene, or otherwise objectionable or harmful, or that contains or links to a virus, bug, worm, malware, Trojan horse, or other harmful or disruptive element."^neutral
In the Terms of Use applicable to users in Europe, it states that, "Unfortunately, due to the nature of the Internet and technology, Brainly Services is provided on an "as available" and "as is" basis. This means that we are unable to promise that your use of Brainly Services will be error-free." A similar statement is given in the Terms of Use applicable to users not in Europe: "YOUR USE OF THE BRAINLY SERVICES AND/OR ANY PRODUCTS, SERVICES, FUNCTIONALITY, CONTENT, INFORMATION, OR OTHER MATERIALS AVAILABLE ON, THROUGH OR IN CONNECTION WITH THE BRAINLY SERVICES OR YOUR BRAINLY SUBSCRIPTION, INCLUDING, BUT NOT LIMITED TO, THE MOBILE SOFTWARE, IS AT YOUR OWN RISK. THE BRAINLY SERVICES AND ANY PRODUCTS, SERVICES, FUNCTIONALITY, INFORMATION, CONTENT OR OTHER MATERIALS AVAILABLE ON OR THROUGH THE BRAINLY SERVICES AND YOUR BRAINLY SUBSCRIPTION ARE PROVIDED ON AN “AS IS” AND “AS AVAILABLE” BASIS."^bad
From the Brainly FAQ (https://faq.brainly.com/hc/en-us/articles/205369412-What-makes-a-great-answer-), it states, "Don’t spam or advertise Brainly is for learning, not promoting! An answer is not the place to advertise your own site."^neutral
The Terms of Use (in Part A, applicable to users unless you are in Europe) state that, "The Brainly Services and Brainly Subscriptions are not intended for children under 13 years of age. We do not knowingly collect or solicit personal information from anyone under the age of 13 or knowingly allow such persons to register." The Terms of Use (in Part B, applicable to users in Europe) state that, "You must be 13 years or older to use Brainly Services."^neutral
From Terms of Service, "If you would like to delete your Account, please e-mail us at community@brainly.com." Also from https://faq.brainly.com/hc/en-us/articles/206192659-How-can-I-delete-my-account-, it presents three ways to delete an account.^good
|The FAQ page (https://faq.brainly.com/hc/en-us/articles/206193329-Can-I-delete-my-question-or-answer-) states that "questions and answers are only removed if they do not meet our posting guidelines, or violate one of our site rules. Since your question or answer might help other students, we aim to preserve all content posted on the site which can be accessed by anyone in the future who might need the information for a school assignment or project." The Privacy Policy also states that "your content and comments you post to public areas of the Service will be viewable by others on the Service and the public," and that "we may also share information with others in an aggregated or otherwise anonymized form that does not reasonably identify you directly as an individual." 

 With regards to modifying or deleting your information, the Privacy Policy says, "If you have any questions about reviewing, modifying, or deleting your information, or if you want to remove your name or comments from our Service or publicly displayed content, you can contact us directly at privacy@brainly.com. We may not be able to modify or delete your information in all circumstances." Moreover, the right to erasure (which only applies for users in the EU and Switzerland) specified in the Privacy Policy only applies under "certain circumstances, such as where the personal data is no longer necessary in relation to the purposes for which it was collected or processed." 

If Brainly aims to "preserve all content posted on the site," then we can conclude that such personal data is still necessary for the purpose of the site. There are places on the site where answers without usernames or profile pictures are visible.|^bad
The Terms of Use (in Part A, applicable to users unless you are in Europe) state that, "You agree not to post on or transmit onto the Brainly Services or Mobile Software any information that you know to be untrue, that is unlawful, fraudulent, threatening, malicious, harassing, abusive, libelous, defamatory, obscene, or otherwise objectionable or harmful, or that contains or links to a virus, bug, worm, malware, Trojan horse, or other harmful or disruptive element. The Terms of Use (in Part B, applicable to users in Europe) state that, "You must only use Brainly Services for lawful and information purposes."^neutral
The Terms of Use (in Part B, applicable to users in Europe) states that "the Service may, from time to time, contain links to and from third party services. If you follow a link to any of these services, please note that these services have their own privacy policies and that we do not accept any responsibility or liability for their policies. Please check the individual policies before you submit any information to those services."^neutral
The Terms of Use (in Part B, applicable to users in Europe) state that, "If you do not comply with these Terms of Use and we do not take action immediately, this does not mean we have given up any right we have and we may still take action in the future."^neutral
The Terms of Use (in Part A, applicable to users unless you are in Europe) state that, "You understand and acknowledge that anyone with knowledge of your User Credentials may gain access to any information, including your Personal Information, you have stored in the password-protected portion of the Brainly Services. You agree to keep your password secret, to notify us if your password is lost or compromised, and to be solely responsible for the confidentiality and use of your User Credentials."^neutral
The Privacy Policy states that "you can stop receiving promotional email communications from us by clicking on the “unsubscribe link” provided in such communications. We make every effort to promptly process all unsubscribe requests. You may not opt out of service-related communications (e.g., account verification, transactional communications, changes/updates to features of the Service, technical and security notices)."^good
The Terms of Use (in Part A, applicable to users unless you are in Europe) state that, "BRAINLY MAKES NO WARRANTY THAT THE BRAINLY SERVICES AND/OR ANY PRODUCTS, SERVICES, FUNCTIONALITY, INFORMATION, CONTENT OR OTHER MATERIALS AVAILABLE ON, THROUGH OR IN CONNECTION WITH THE BRAINLY SERVICES OR YOUR BRAINLY SUBSCRIPTION, INCLUDING, BUT NOT LIMITED TO, THE MOBILE SOFTWARE, WILL MEET YOUR REQUIREMENTS . . . OR AS TO THE ACCURACY OR COMPLETENESS OF ANY INFORMATION OR CONTENT ACCESSIBLE FROM OR PROVIDED IN CONNECTION WITH THE BRAINLY SERVICES OR BRAINLY SUBSCRIPTIONS, REGARDLESS OF WHETHER ANY INFORMATION OR CONTENT IS MARKED AS “VERIFIED”."^bad
The Privacy Policy states, "We participate in interest-based advertising and use third party advertising companies to serve you targeted advertisements based on your online browsing history and your interests.  We permit third party online advertising networks, social media companies and other third party services, to collect, information about your use of our Service over time so that they may play or display ads on our Service, on other websites, apps or services you may use, and on other devices you may use. Typically, though not always, the information used for interest-based advertising is collected through cookies or similar tracking technologies. We and our third party partners use this information to make the advertisements you see online more relevant to your interests, as well as to provide advertising-related services such as reporting, attribution, analytics and market research."^bad
The Privacy Policy states that in regard to links to and from third party websites, "We strongly recommend that you read their privacy policies and terms and conditions of use to understand how they collect, use, and share information. We are not responsible for the privacy practices or the content on the websites of third party sites."^neutral
The Terms of Use is a two-part document. Part A applies to users that are not based in Europe and Part B applies to users in Europe. It should be noted that Part B is a more readable document than Part A, as the sections and points are enumerated and the language used is not as rich with legalese. There are also some statements in the Privacy Policy that apply to users in the EU or Switzerland only.^neutral
The Terms of Use (in Part A, applicable to users unless you are in Europe) state that, "BRAINLY MAKES NO WARRANTY THAT THE BRAINLY SERVICES AND/OR ANY PRODUCTS, SERVICES, FUNCTIONALITY, INFORMATION, CONTENT OR OTHER MATERIALS AVAILABLE ON, THROUGH OR IN CONNECTION WITH THE BRAINLY SERVICES OR YOUR BRAINLY SUBSCRIPTION, INCLUDING, BUT NOT LIMITED TO, THE MOBILE SOFTWARE, WILL MEET YOUR REQUIREMENTS."^bad
The Terms of Use (in Part A, applicable to users unless you are in Europe) state that, "These Terms will be governed by and construed in accordance with the laws of the State of New York, excluding provisions of that would result in choice of the law of another jurisdiction to govern these Terms." The Terms of Use (in Part B, applicable to users in Europe) state that "English law will apply to all disputes and the interpretation of these Terms of Use. The English courts will have non-exclusive jurisdiction over any dispute arising from or related to your use of the Service."^neutral
"Brilliant reserves the right, at its sole discretion, to modify or replace any of the terms or conditions of this Agreement at any time. It is User's responsibility to check this Agreement periodically for changes."^bad
The Brilliant Cookie Policy states, "The Services use cookies and similar technologies such as pixel tags, web beacons, clear GIFs, JavaScript, and local storage."^bad
The Terms of Use state that "Brilliant reserves the right to, in its sole discretion, remove any User Submission(s) at any time (with or without notice)."^blocker
Bumble Trading Inc reserve the right at our sole discretion to terminate or suspend any Account, or make use of any operational, technological, legal or other means available to enforce the Terms (including without limitation blocking specific IP addresses), at any time without liability and without the need to give you prior notice.^bad
You'll have great fun on Bumble, but if you feel the need to leave, you can delete your Account at any time by going to the 'Settings' page when you are logged in and clicking on the 'Delete account' link. Your Account will be deleted immediately but it may take a little while for Your Content to be completely removed from the App.^good
From Privacy Policy: "CARFAX web sites may contain web beacons to collect data regarding user traffic patterns. CARFAX web sites use cookies to collect information about your computer hardware (desktop, laptop, mobile devices and mobile device identifiers etc.) and software, including but not limited to, referring domains, the type of browser used, operating system software, screen resolutions, color capabilities, IP addresses and plug-ins."^bad
From Cengage Privacy Notice, 5. Cookies and Other Data Collection Technologies, they use Flash Cookies, Pixel Tags, and Web Beacons. They also "collect many different types of information from server logs and other technologies.  For example, [they] may collect information the device you use to access our website, your operating system type, browser type, domain, and other system settings, as well as the language your system uses and the country and time zone where your device is located."^bad
personal data is not sold^good
They can change the terms of service any time they see fit, even without notification to the user. Your use of the service supposedly constitutes acceptance of the changes in the terms.^bad
If Cloudant, any of their affiliated companies, their assets, or the assets of their affiliated companies, are acquired by another business, they expect any hosted, personal, and billing information to be transferred (along with their other business assets) to the new business.^bad
your data may be stored anywhere in the world^bad
"CBS Interactive Services may collect [...] Your device type and settings, software used and browser type and operating system"^bad
The Terms of Use state that, "In no case are persons under the age of thirteen permitted to use the Services."^neutral
The Terms of Use state that, "You are responsible for maintaining the confidentiality of your user account login names and passwords, and must not permit use of your account by anyone other than members of your household.  You accept responsibility for all activities, charges, and damages that occur under your account, including use of your account by other members of your household, and unauthorized use of your account.  If you have reason to believe that someone is using your account without your permission, you should contact us immediately.  We are not responsible for any loss or damage resulting from unauthorized use."^neutral
Quoted, "Changes to Terms of Use. CNN may modify the Terms of Use, or any part thereof, or add or remove terms at any time, and such modifications, additions or deletions will be effective immediately upon posting."^bad
"We [..] may use automated means to collect [...] network or Internet protocol address and type of browser you are using (e.g., Chrome, Safari, Firefox, Internet Explorer), the type of operating system you are using, (e.g., Microsoft Windows or Mac OS), the name of your Internet service provider (e.g., Comcast, Verizon or AT&T) [...], device settings, browser settings, the web pages of the Services you have visited, Services visited before and after you visit a Service, the type of handheld or mobile device used to view the Service (e.g., iOS, Android), location information, and the content and advertisements you have accessed, seen, forwarded and/or clicked on."^bad
They will change the date on the document, and you will be considered to have accepted the change by continuing to use the service.^bad
|"REPEAT INFRINGER POLICY 
In accordance with the Digital Millennium Copyright Act ("DMCA") and 
other applicable law, CouchSurfing has adopted a policy of 
terminating, in appropriate circumstances and in CouchSurfing's sole 
discretion, members who are deemed to be repeat infringers. 
CouchSurfing may also, in our sole discretion, limit access to the 
Services and/or terminate the accounts of any members who we believe 
may infringe any intellectual property rights of others, whether or 
not there is any repeat infringement."|^bad
|"21.7 Survival. Sections 4.4 (Release), 5 (Member Conduct and 
Content), 6 (Submissions), 10 (Trademarks), 12 (Third-Party Content), 
15 (Member's Representations and Warranties), 16 (Disclaimer of 
Warranties), 17 (Limits on Liability), 18 (Indemnity), 20 (Disputes), 
and this Section 21 (Miscellaneous) shall survive any termination or 
expiration of these Terms." 
section 5 is the one that contains the license they get on your content.|^bad
|"Sharing of Information 
We do not share personal information about you with third parties 
except as follows: 
[...] 
In connection with, or during negotiations of, any merger, sale of 
company assets, financing or acquisition of all or a portion of our 
business to another company". The consensus on this thread is that this is standard practice, so does not merit negative points.|^bad
|"5.3 Member Content License. If you post Member Content to our 
Services, you hereby grant us a perpetual, worldwide, irrevocable, 
non-exclusive, royalty-free and fully sublicensable license to use, 
reproduce, display, perform, adapt, modify, create derivative works 
from, distribute, have distributed and promote such Member Content in 
any form, in all media now known or hereinafter created and for any 
purpose, including without limitation the right to use your name, 
likeness, voice or identity."|^bad
|"If you provide a 
Submission, you agree that it is non-confidential (unless CouchSurfing 
states otherwise in writing) and shall become the sole property of 
CouchSurfing."|^bad
|We 
may automatically collect information using cookies, web beacons (also 
known as "gifs," "pixel tags" and "tracking pixels") and other 
tracking technologies to, among other things, improve our Services and 
your experience, monitor user activity, count visits, understand usage 
and campaign effectiveness and tell if an email has been opened and 
acted upon. For information about removing or rejecting cookies, 
please see "Your Information Choices" below."|^bad
|"may retain certain information as required by law, for legitimate 
business purposes and to protect member safety." They say they will hold data from already 
closed accounts in order to help them combat fraud on the platform. |^bad
|you have to provide accurate, truthful, current and complete 
information when creating an account on CouchSurfing.|^neutral
|"You may opt out of receiving promotional emails from CouchSurfing by 
following the instructions in those emails or by adjusting the 
appropriate settings in your profile." - this means the default is that they will send you
promotional communications that you didn't ask them to send you.|^good
|"We may also share aggregated or anonymized information that does not 
directly identify you."|^neutral
|"Cookies 
Most web browsers are set to accept cookies by default. If you prefer, 
you can usually choose to set your browser to remove or reject browser 
cookies; however, our Services may not function properly if you do 
so."|^bad
|The community guidelines are here: 
http://www.couchsurfing.org/guidelines 
you agree to follow them.|^neutral
|"Because our Services are merely a platform, in the event 
that you have a dispute with one or more members, you release us (and 
our officers, directors, members, employees, agents and affiliates) 
from claims, demands and damages [...]"|^neutral
The Privacy Policy states, "Technologies such as: cookies, beacons, tags and scripts are used by the Website and our partners, affiliates, or analytics or service providers."^bad
The Terms of Use state, "You understand and agree that if you delete your account, it may not be possible to completely delete that content from Course Hero’s records, and that your Submissions will remain viewable elsewhere as part of the Services and to the extent that they were downloaded or stored by other Users."^blocker
The Terms of Use state, "You represent, warrant, and agree that you will not contribute any Submission that, or otherwise use the Services or interact with the Services in a manner that . . . "Crawls," "scrapes," or "spiders" any page, data or portion of or relating to the Services or Content (through use of manual or automated means)."^bad
Coursera reserve the right to change or modify the Terms of Use at their sole discretion at any time.^bad
Terms of use states "You agree to indemnify, defend, and hold harmless the Coursera Parties from any and all claims, liabilities, expenses, and damages, including reasonable attorneys' fees and costs, made by any third party related to: (a) your use or attempted use of the Services in violation of these Terms; (b) your violation of any law or rights of any third party; or (c) User Content, including without limitation any claim of infringement or misappropriation of intellectual property or other proprietary rights."^bad
The Terms of Use states that "By submitting any Feedback, you grant us the right to use the Feedback without any restriction or any compensation to you".^bad
The Terms of Use states "To the extent that you provide User Content, you grant Coursera a fully-transferable, royalty-free, perpetual, sublicensable, non-exclusive, worldwide license to copy, distribute, modify, create derivative works based on, publicly perform, publicly display, and otherwise use the User Content."^bad
Craigslist.org [Bad] No scraping^bad
Craigslist.org [Info] California Jurisdiction^neutral
Even though the Do Not Track (DNT) header was not implemented perfectly, services should not track users whose browsers send a DNT header.^bad
Terms include a table of contents and most, but not all, sections include a plain language summary.^good
Privacy Policy: "You can set your browser to refuse cookies, but some portions of the Website may not work properly if you refuse cookies."^bad
From Terms of Service: "You retain your ownership in and to Content you submit, post or upload to the Services, and your use of the Services does not transfer any ownership from you to Crowdmark."^good
From Terms of Service: "You hereby waive, in favour of Crowdmark, your moral rights under Canada’s Copyright Act or any successor legislation or similar law under the laws of Canada or the laws of other countries, that you, as author, have or may in your Content."^blocker
From Privacy Policy: "If Crowdmark is to be sold, merged or amalgamated or is to sell or dispose of substantially all of its assets, your personal information may be transferred to a potential purchaser if, and to the extent, necessary for the purposes of deciding whether to proceed with the sale and completing the sale."^bad
From Terms of Service: "These Terms of Service are governed, interpreted and construed in accordance with the laws of the Province of Ontario and the applicable laws of Canada, without giving effect to any principles of conflicts of laws contained therein, and you hereby consent and submit to the exclusive jurisdiction of the Courts of Ontario."^neutral
|They do not allow children under 16 on the platform unless allowed and under supervision by the parents. Data can be removed by mailing privacy@ellation.com
|^neutral
The Terms of Service state, "Subject to Section 10(f<em>), </em>any dispute arising out of these Terms, the Privacy Policy, or the Services will be resolved exclusively on an individual basis by binding and confidential arbitration conducted in the English language." Note that you can opt out: "Opt Out. You may opt out of the provisions of this Arbitration Agreement requiring and governing arbitration by sending written notice to legal@dashlane.com or via mail to Dashlane, Inc. 156 Fifth Ave., Ste. 504 New York, NY 10010, within thirty (30) days after accepting these Terms."^bad
Delicious “may sell, transfer or otherwise share some or all of its assets, including your Personal Information, in connection with a merger, acquisition, reorganization or sale of assets or in the event of bankruptcy.”^bad
"When you use the Services, we automatically collect and store [...] Technical information about your computer or mobile device (such as type of device, web browser or operating system)"^bad
|The terms of service state under the title "MODIFICATIONS TO TERMS OF SERVICE":

