"Discogs may at any time revise the TOS by updating this posting. By using Discogs, You agree to be bound by any such revisions and should therefore periodically visit this page to determine the then-current TOS to which You are bound. Your continued use of Discogs constitutes an affirmative: (1) acknowledgment by You of the TOS and TOS modifications; and (2) agreement by You to abide and be bound by the TOS and TOS modifications."|^bad
When other users make complaints to Discogs, Discogs is able to read your private messages, review your account activity, account details and previous orders.^bad
|INDEMNITY

You agree to indemnify and hold Discogs, and its subsidiaries, affiliates, officers, agents, co-branders or other partners, and employees, harmless from any alleged claim or demand, including reasonable attorney fees, made by any third party due to or arising out of Your use of the Service, Your connection to the Service, Your violation of the TOS, or Your violation of any rights of another, whether You are a registered user or not. You are solely responsible for Your actions when using the Service, including, but not limited to, costs incurred for Internet access.|^bad
|Under "TERMINATION" Discogs' ToS state:

"You agree that Discogs, in its sole discretion, may terminate Your account, and remove and discard any content within the Service, for any reason, including and without limitation, the lack of use, or if Discogs finds that You have violated or acted inconsistently with the letter or spirit of the TOS. You agree that any termination of Your access to the Service under any provision of this TOS may be effected without prior notice, and acknowledge and agree that Discogs may immediately deactivate or delete Your Discogs account and any or all related information and files. Discogs reserves the right to bar any further access to such files or the Service. You agree that Discogs shall not be liable to You or any third-party for any termination of Your access to the Service. Advanced accounts that are terminated will not be refunded.

Should You object to any terms and conditions of the TOS or any subsequent modifications thereto or become dissatisfied with the Service in any way, Your only recourse is to immediately discontinue use of the Service.

Upon termination of the Service, Your right to use the Service immediately ceases. You shall have no right and Discogs will have no obligation thereafter to forward any unread or unsent messages to You or any third party."|^bad
Discogs is not liable for any damages to the users' computer systems that occur as a result of downloading material from Discogs.^neutral
(b) DISCOGS MAKES NO WARRANTY THAT [...] (V) ANY ERRORS IN THE SOFTWARE WILL BE CORRECTED.^bad
|Discogs waives all liability for any losses or damages users may incur from using the service or not being able to use it, from the cost of using substitute products, from unauthorized access to their data, from any third party (other users') actions on the service or any other matter relating to the service.
By including "(v) ANY OTHER MATTER RELATING TO THE SERVICE", Discogs essentially excludes any possible liabilities.|^bad
Discogs and its related platforms are based on user content. As such, by using the service, users grant Discogs a non-revocable and transferable right to use their content for as long as they wish, wherever they wish.^neutral
Under the healines "LINKS" the ToS say: "The Service, or relevant third parties, may provide links to other websites or resources. Because Discogs has no control over such sites and resources, You acknowledge and agree that Discogs is not responsible for the availability of such external sites or resources, and does not endorse and is not responsible or liable for any content, advertising, products, or other materials on or available from such sites or resources. You further acknowledge and agree that Discogs shall not be responsible or liable, directly or indirectly, for any damage or loss caused or alleged to be caused by or in connection with use of or reliance on any such content, goods or services available on or through any such site or resource."^neutral
|The Discogs ToS state under "LICENSING OF USER CONTENT":
"If You cease using Discogs Services, You confirm that Discogs is entitled to continue using Your user-generated content and may continue display Your user name along with Your content pursuant to the rights granted above."|^bad
The court of law for Discogs is located in the State of Oregon, USA. The United States have implemented some laws that are detrimental to the privacy of users of US-American services, most noticeably the PATRIOT Act.^bad
|Discogs' ToS state under "MODIFICATIONS TO SERVICE": 
"Discogs reserves the right to modify or discontinue the Service with or without notice to You. Discogs shall not be liable to You or any third party should Discogs exercise TOS right to modify or discontinue the Service."

- the service can not only be discontinued, but also modified at any time
- discogs do not need to notify users of these changes|^bad
Under "DISCLAIMER OF WARRANTIES", Discogs' ToS state that the website will not warrant "UNINTERRUPTED, TIMELY, SECURE, OR ERROR-FREE" service.^bad
|Under "LICENSE AND SITE ACCESS", the ToS state:

"Discogs grants You a limited license to access and make personal use of this site and not to download (other than page caching) or modify it, or any portion of it, except with express written consent of Discogs. This license does not include any resale or commercial use of this site or its contents; any collection and use of any product listings, descriptions, or prices; any derivative use of this site or its contents; any downloading or copying of account information for the benefit of another merchant; or any use of data mining, robots, or 
similar data gathering and extraction tools. This site or any portion of this site may not be reproduced, duplicated, copied, sold, resold, visited, or otherwise exploited for any commercial purpose without express written consent of Discogs."

- the site or its contents may not be used for any commercial purpose|^neutral
Discogs' ToS state: "You agree not to transmit through the Service any unlawful, harassing, libelous, abusive, threatening, or harmful material of any kind or nature. You further agrees not to transmit any material that encourages conduct that could constitute a criminal offense, give rise to civil liability or otherwise violate any applicable local, state, national or international law or regulation."^neutral
Under "USER CONDUCT", Discogs' ToS state: "Attempts to gain unauthorized access to other computer systems are prohibited."^neutral
|Discogs' ToS state: "You shall not interfere with another person’s use and enjoyment of the Service or another entity's use and enjoyment of similar services."
This statement is kept very vague and could potentially be used as grounds for censorship or account deletion.|^bad
Discogs disclaims any express or implied warranties.^bad
To use Discogs, users must be of the minimum age of consent, which varies by jurisdiction. In the case of the United States, users must be at least 13 years old to sign up for an account and 18 years old to buy and sell items on Discogs.^neutral
The ToS state under "USER CONDUCT": "You will not use the Service for chain letters, junk mail, spamming or any use of distribution lists to any person who has not given specific permission to be included in such a process."^neutral
|Under "LICENSING OF USER CONTENT", the ToS state:
"If You cease using Discogs Services, You confirm that Discogs is entitled to continue using Your user-generated content and may continue display Your user name along with Your content pursuant to the rights granted above.

If You exercise Your right to erasure or deletion of personal information pursuant to the Privacy Policy, (i) Your user-generated content will be anonymized by having the user name replaced by a generic term (i.e., "previous user1234" or simply "user1234"), and (ii) Discogs is entitled to continue using this anonymized user-generated content pursuant to the rights granted above."|^bad
|The ToS state under "USER ACCOUNT, PASSWORD, AND SECURITY": 
"[...] You may change Your password at any time; You may also set up a new account and close an old one at Your convenience. [...]"|^good
|The ToS state under the headline "USER ACCOUNT, PASSWORD, AND SECURITY": 
"[...] You are entirely responsible for any and all activities which occur under Your account if You do not maintain the confidentiality of Your password and account. Furthermore, You are entirely responsible for any and all activities which occur under Your account by You or someone You authorize to use Your account. [...]"|^neutral
Should one portion of the ToS be invalid, Discogs will enforce it as much as possible under applicable law. The invalidity of one portion does not affect any other provision of the ToS.^neutral
Even if Discogs does not consistently enforce all of the rules or provisions in its terms, they still apply. Users can at a later time still be held accountable for violating provisions that have not been enforced consistently.^neutral
|Discogs' ToS state under "USER CONDUCT":

"You agree: [...] (2) not to use the Service for illegal purposes; (3) not to interfere or disrupt networks connected to the Service; and (4) to comply with all regulations, policies and procedures of networks connected to the Service.

The Service makes use of the Internet to send and receive certain messages; therefore, Your conduct is subject to Internet regulations, policies and procedures. You will not use the Service for chain letters, junk mail, spamming or any use of distribution lists to any person who has not given specific permission to be included in such a process.

You agree not to transmit through the Service any unlawful, harassing, libelous, abusive, threatening, or harmful material of any kind or nature. You further agrees not to transmit any material that encourages conduct that could constitute a criminal offense, give rise to civil liability or otherwise violate any applicable local, state, national or international law or regulation. Attempts to gain unauthorized access to other computer systems are prohibited.

You shall not interfere with another person’s use and enjoyment of the Service or another entity's use and enjoyment of similar services."|^neutral
Discogs' ToS state that "(b) DISCOGS MAKES NO WARRANTY THAT (i) THE SERVICE WILL MEET YOUR REQUIREMENTS, [...] (iv) THE QUALITY OF ANY PRODUCTS, SERVICES, INFORMATION, OR OTHER MATERIAL PURCHASED OR OBTAINED BY YOU THROUGH THE SERVICE WILL MEET YOUR EXPECTATIONS"^bad
Discogs distances itself from any messages or ideas users include in the content they generate on the website.^neutral
|The ToS state under "USER CONDUCT":
"[...] Your use of the Service is subject to all applicable local, state, national and international laws and regulations.

You agree: (1) to comply with U.S. and applicable international law regarding the transmission of technical data exported from the your country through the Service; [...]"|^neutral
Any conflicts regarding Discogs' Terms of Service will be submitted to the courts of the State of Oregon, USA. The Terms will be interpreted according to the laws of Oregon. By using Discogs, users agree to this exclusive jurisdiction.^neutral
The Company reserves the right to modify or discontinue, temporarily or permanently, the Service (or any part thereof) with or without notice. The Company reserves the right to refuse any user access to the Services without notice for any reason, including but not limited to a violation of the Terms.^bad
Under the section 'Rights to Use the Service', the terms state "The Company reserves the right to refuse any user access to the Services without notice for any reason, including but not limited to a violation of the Terms", meaning that it can prevent you from using the service for reasons not enforced by the terms, and without stating such a reason.^bad
In a court of competent jurisdiction located in San Francisco County, California.^neutral
"By visiting or using the Service, you agree that the laws of the United States and the State of California, without regard to principles of conflict of laws and regardless of your location, will govern these Terms and any dispute of any sort that might arise between you and the Company. Any claim or dispute between you and the Company that arises in whole or in part from these Terms or your use of the Service shall be decided exclusively by a court of competent jurisdiction located in Santa Clara County, California, and you hereby consent to, and waive all defenses of lack of personal jurisdiction and forum non conveniens with respect to venue and jurisdiction in the state and federal courts of Santa Clara County, California."^neutral
Their privacy policy state: "DiscourseHosting.com has the discretion to update this privacy policy at any time. When we do, we will revise the updated date at the bottom of this page. We encourage Users to frequently check this page for any changes to stay informed about how we are helping to protect the personal information we collect. You acknowledge and agree that it is your responsibility to review this privacy policy periodically and become aware of modifications."^bad
As stated in the Terms of Service, DiscourseHosting reserves the right to amend any or all of the above policies, guidelines and disclaimer upon thirty (30) days prior written notice to you.^good
The Terms of Service and Privacy Policy do not address issues of compliance with government requests or inquiries that may involve user data.^bad
The Terms of Service state: "We offer an uptime guarantee of 99.9%. Any downtime over 0.1% will be refunded with a prorated fee based on actual downtime per month. Our network and servers are monitored continuously, and are rarely down except for scheduled maintenance and hardware and software upgrades."^good
They can change the terms of service any time they see fit, even without notification to the user. Your use of the service supposedly constitutes acceptance of the changes in the terms.^bad
|This website does not support “Do Not Track” requests.
To determine whether any of the third-party services it uses honor the “Do Not Track” requests, please read their privacy policies.|^bad
No refund policy^neutral
"These Terms don't give us any rights to Your Stuff except for the limited rights that enable us to offer the Services."^good
Dropbox removes Copyright intellectual property after a claim^neutral
They can change the terms of service any time they see fit, but they will notify the user. Your use of the service supposedly constitutes acceptance of the changes in the terms.^good
"These and other features may require our systems to access, store and scan Your Stuff. You give us permission to do those things, and this permission extends to our affiliates and trusted third parties we work with."^bad
[Good] Dropbox allows you to leave the service^good
DuckDuckGo doesn't save <em>your</em> searches and doesn't send your searches to other sites. No personal information is saved either. No cookies are used by default, but cookies can be saved on your computer for some features (e.g. settings). “We also save searches, but again, not in a personally identifiable way, as we do not store IP addresses or unique User agent strings. We use aggregate, non-personal search data to improve things like misspellings.”^good
I think this is the correct case: although they mark updates, they do not contact the user. (Which makes sense because they don't have contact details, but still.) Also, the changes take effect immediately.^neutral
eBay does not respond to Do Not Track signals, but provides a notice for their use of Cookies (http://pages.ebay.com/help/account/cookies-web-beacons.html)^bad
They can modify or discontinue their Services and reserve the right to refuse or terminate all or part of their Services to anyone for any reason at their discretion.^bad
See quote.^good
info given about what personal data they collect^good
Terms of Use for www.ello.co^bad
Their privacy policy states: 'We may update these Terms from time to time; you should check this page regularly to take notice of any changes. Your continued use of the Services following the posting of revised Terms means that you accept and agree to the changes.'^bad
"We may also collect information about your use of the Services [...], including your IP address, browser information (including referrers), device information (such as [...])"^bad
When installing the Facebook app on an Android phone, it allows access to the audio record path and to take pictures with the camera. This allows the application at any time to collect images the camera is seeing.^bad
|"      If you’re logged out or don’t have a Facebook account and visit
        a website with the Like button or another social plugin, […] We
        do receive the web page you're visiting, the date and time, and
        other browser-related information. We record this information
        for a limited amount of time […] we sometimes find bugs in the
        systems we’ve built to gather aggregate data on how people are
        interacting with sites that use the Like button or other social
        plugins. It’s helpful to be able to reference this anonymized
        information when investigating these bugs so we can find their
        source and fix them quickly. "|^bad
This service uses cookies to track you even if you are not interacting with them directly. Amazon for instance, use <a href="http://www.amazon.com/gp/help/customer/display.html/ref=hp_468496_cookies?nodeId=468496&amp;#cookies">cookies</a> to track your device and serve targeted advertisements on other websites (Amazon associates, websites using Amazon Checkout). They “obtain certain types of information when your Web browser accesses Amazon.com or advertisements and other content served by or on behalf of Amazon.com on other Web sites”.^bad
The scope of the copyright license granted to Facebook includes the rights to transfer and sublicense. This means your content can be licensed by Facebook to third-parties.^bad
Collects all data you send (username, email, credit card number...), any kind of info other put about you as well. Plus all info about your device: "Attributes such as the operating system, hardware version, device settings, file and software names and types, battery and signal strength, and device identifiers. Device locations, including specific geographic locations, such as through GPS, Bluetooth, or WiFi signals. Connection information such as the name of your mobile operator or ISP, browser type, language and time zone, mobile phone number and IP address."^bad
Including: data analysis, testing, service improvement, control of the effectiveness of the personal ads, and location features and services.^bad
The terms state: "In addition, content you delete may continue to appear if you have shared it with others and they have not deleted it."^blocker
using personal information for targeted advertising^bad
Collects all data you send (username, email, credit card number...), any kind of info other put about you as well. Plus all info about your device: "Attributes such as the operating system, hardware version, device settings, file and software names and types, battery and signal strength, and device identifiers. Device locations, including specific geographic locations, such as through GPS, Bluetooth, or WiFi signals. Connection information such as the name of your mobile operator or ISP, browser type, language and time zone, mobile phone number and IP address."^bad
Facebook give personal details to 3rd Party by default^bad
Facebook uses, pixels and local storage in order to gather information about you, your device, your browser cache, your use of Facebook.  Facebook also uses cookies for adversing purposes.^neutral
AH!^bad
They can change the terms of service any time they see fit. Your use of the service supposedly constitutes acceptance of the changes in the terms.^bad
Flattr is available only to individuals who are at least 18 years old. ^neutral
The copyright license granted to Yahoo for photos, graphics, audio and video is limited “solely for the purpose for which such Content was submitted or made available”. ^good
"When you access and interact with the Fox News Services, Fox News and its service providers may collect certain information about those visits. For example, in order to permit your connection to the Fox News Services, our servers receive and record information about your computer, device, and browser, including potentially your IP address, browser type, and other software or hardware information."^bad
"When you access and interact with the Fox News Services, Fox News and its service providers may collect certain information about those visits. For example, in order to permit your connection to the Fox News Services, our servers receive and record information about your computer, device, and browser, including potentially your IP address, browser type, and other software or hardware information."^bad
age limit^neutral
The terms for this service are easy to read^good
no tracking^good
IP addresses of website visitors are not tracked^neutral
info given about what personal data they collect^good
easy to read^good
 If we make any material changes to this Privacy Policy, we'll notify you of those changes by posting them on the Services or by sending you an email or other notification, and we'll update the "Last Updated Date" above to indicate when those changes will become effective.^neutral
The Privacy Policy states "All information and supporting documentation that you share with us will be held securely and will never by disclosed to a third party without your prior written agreement."^good
The Privacy Policy states "There is no requirement to provide us with any personal information if you want to use the free online information resource on our website."^good
|The Privacy Policy states "Flat Justice recognises that individuals have the right to access their personal data and can make a request verbally or in writing. If we receive a subject access request asking what information is held about them, we will deal with the request without undue delay and at the latest within one month of receipt."
|^good
The Cookie pop-up menu displays checkboxes for the user to opt out of third party cookie tracking. If all available boxes are unticked by the user, the only cookie which is kept is the one which stores these user preferences.^good
In addition, the user may opt out of all cookie tracking except the one cookie which tracks the user's cookie preferences.^good
The Privacy Policy states "Flat Justice will never sell, rent, or lease your personally identifiable information to others.". Note: FlatJustice is the community interest company which owns the GetRentBack website.^good
One single A4 sheet, divided into columns.^good
“GitHub, in its sole discretion, has the right to suspend or terminate your account and refuse any and all current or future use of the Service, or any other GitHub service, for any reason at any time. Such termination of the Service will result in the deactivation or deletion of your Account or your access to your Account, and the forfeiture and relinquishment of all Content in your Account. GitHub reserves the right to refuse service to anyone for any reason at any time. ” However, most of your data at GitHub can be exported with 'git clone' (for the wiki) and with the API (for the issues).^bad
History can be found via the source link.^good
“We transfer information about you if GitHub is acquired by or merged with another company. In this event, GitHub will notify you before information about you is transferred and becomes subject to a different privacy policy. ”^good
free software; you can run your own instance^good
critical changes without user involvement^bad
From the terms: "The Website is available only to individuals who are at least 13 years old."^neutral
"GitLab has not reviewed, and cannot review, all of the material, including computer software, posted to the Website, and cannot therefore be responsible for that material’s content, use or effects." and "GitLab disclaims any responsibility for any harm resulting from the use by visitors of the Website,"^neutral
you can choose the copyright license^good
From the terms: "This Agreement shall be governed by and interpreted in accordance with the laws of the Netherlands."^neutral
If we change our privacy policies and procedures, we will post those changes on our website to keep you aware of what information we collect, how we use it and under what circumstances we may disclose it. Changes to this Privacy Policy are effective when they are posted on this page. ^neutral
no tracking^good
This service uses cookies to track you even if you are not interacting with them directly.^bad
At http://www.google.com/intl/en/policies/terms/archive/ you can see at least one previous versions of Google's terms^good
The copyright license you grant is “for the limited purpose of operating, promoting, and improving” existing and new Google Services. However, please note that the license does not end if you stop using the Google services.^neutral
Google can share your personal information with other parties. For sensitive information (medical, racial, ethnic, political, religious or sexuality) Google requires “opt-in”. Google can also share or publish aggregated data that does not identify a person^bad
